show grants;
Grants for root@localhost
GRANT SELECT, INSERT, UPDATE, DELETE, CREATE, DROP, RELOAD, SHUTDOWN, PROCESS, FILE, REFERENCES, INDEX, ALTER, SHOW DATABASES, SUPER, CREATE TEMPORARY TABLES, LOCK TABLES, EXECUTE, REPLICATION SLAVE, REPLICATION CLIENT, CREATE VIEW, SHOW VIEW, CREATE ROUTINE, ALTER ROUTINE, CREATE USER, EVENT, TRIGGER, CREATE TABLESPACE, CREATE ROLE, DROP ROLE ON *.* TO `root`@`localhost` WITH GRANT OPTION
GRANT APPLICATION_PASSWORD_ADMIN,AUDIT_ABORT_EXEMPT,AUDIT_ADMIN,AUTHENTICATION_POLICY_ADMIN,BACKUP_ADMIN,BINLOG_ADMIN,BINLOG_ENCRYPTION_ADMIN,CLONE_ADMIN,CONNECTION_ADMIN,ENCRYPTION_KEY_ADMIN,FIREWALL_EXEMPT,FLUSH_OPTIMIZER_COSTS,FLUSH_STATUS,FLUSH_TABLES,FLUSH_USER_RESOURCES,GROUP_REPLICATION_ADMIN,GROUP_REPLICATION_STREAM,INNODB_REDO_LOG_ARCHIVE,INNODB_REDO_LOG_ENABLE,PASSWORDLESS_USER_ADMIN,PERSIST_RO_VARIABLES_ADMIN,READ_MASK,REPLICATION_APPLIER,REPLICATION_SLAVE_ADMIN,RESOURCE_GROUP_ADMIN,RESOURCE_GROUP_USER,ROLE_ADMIN,SENSITIVE_VARIABLES_OBSERVER,SERVICE_CONNECTION_ADMIN,SESSION_VARIABLES_ADMIN,SET_USER_ID,SHOW_ROUTINE,SYSTEM_USER,SYSTEM_VARIABLES_ADMIN,TABLE_ENCRYPTION_ADMIN,XA_RECOVER_ADMIN ON *.* TO `root`@`localhost` WITH GRANT OPTION
GRANT PROXY ON ``@`` TO `root`@`localhost` WITH GRANT OPTION
set global cdb_working_mode_enabled=off;
select user();
user()
tencentroot@localhost
create table t1(a int, b int, c int);
insert into t1 values(1,2,3);
select * from t1;
a	b	c
1	2	3
create user 'user1'@'%';
grant all on test.* to 'user1'@'%';
insert into t1 values(2,3,4);
insert into t1 values(3,4,5);
select * from t1;
a	b	c
1	2	3
2	3	4
3	4	5
delete from t1 where t1.a = 3;
update t1 set t1.b=4 where t1.a=2;
select * from t1;
a	b	c
1	2	3
2	4	4
set global cdb_working_mode_enabled=off;
set global cdb_instance_mode=lockwrite;
insert into t1 values(2,3,4);
ERROR HY000: cdb instance is locked for writing.
delete from t1 where t1.a = 1;
ERROR HY000: cdb instance is locked for writing.
update t1 set t1.b = 1 where t1.a = 1;
ERROR HY000: cdb instance is locked for writing.
select * from t1 where t1.a > 1;
a	b	c
2	4	4
set global cdb_instance_mode=readwrite;
insert into t1 values(2,3,4);
delete from t1 where t1.a = 1;
update t1 set t1.b = 1 where t1.a = 1;
select * from t1 where t1.a > 1;
a	b	c
2	4	4
2	3	4
set global cdb_working_mode_enabled=on;
set global cdb_workmode_life_interval=10000000000000;
set global cdb_working_mode_default=readwrite;
set global cdb_instance_mode=lockwrite;
insert into t1 values(10,20,30);
ERROR HY000: cdb instance is locked for writing.
update t1 set t1.b = 40 where t1.a=10;
ERROR HY000: cdb instance is locked for writing.
select * from t1;
a	b	c
2	4	4
2	3	4
set global cdb_instance_mode=readwrite;
insert into t1 values(10,20,30);
update t1 set t1.b = 40 where t1.a=10;
select * from t1;
a	b	c
2	4	4
2	3	4
10	40	30
set global cdb_instance_mode=lockwrite;
set global cdb_working_mode_enabled=on;
set global cdb_working_mode_default=offline;
insert into t1 values(10,20,30);
ERROR HY000: Lost connection to MySQL server during query
set global cdb_working_mode_enabled=off;
set global cdb_working_mode_default=readwrite;
insert into t1 values(2,3,4);
ERROR HY000: cdb instance is locked for writing.
select * from t1;
a	b	c
2	4	4
2	3	4
10	40	30
set global cdb_instance_mode=readwrite;
create table tt(c1 int default null, c2 longtext) engine=innodb default charset=utf8mb4;
create table tt1(c1 int default null, c2 longtext) engine=innodb default charset=utf8mb4;
insert into tt values(1, repeat('a',10));
create procedure test.per2()
begin
declare num int;
set num=1;
while num < 20 do 
insert into test.tt1 values(1, repeat('a',10));
set num=num+1;
end while;
end//
call test.per2;
set debug_sync = "ha_update_row_end wait_for flushed execute 1";
update tt1 set tt1.c2='123' where tt1.c1=1;;
set global cdb_instance_mode=lockwrite;
ERROR 70100: Query execution was interrupted
insert into t1 values(111,222,333);
ERROR HY000: cdb instance is locked for writing.
set global cdb_instance_mode=readwrite;
set debug_sync = "ha_delete_row_execute wait_for flushed execute 1";
delete from t1 where t1.a>1;;
set global cdb_instance_mode=lockwrite;
ERROR 70100: Query execution was interrupted
insert into t1 values(222,333,444);
ERROR HY000: cdb instance is locked for writing.
set global cdb_instance_mode=readwrite;
set debug_sync = "ha_write_row_execute wait_for flushed execute 1";
insert into t1 values(33,44,55),(55,66,77),(66,77,88);;
set global cdb_instance_mode=lockwrite;
ERROR 70100: Query execution was interrupted
insert into t1 values(222,333,444);
ERROR HY000: cdb instance is locked for writing.
set global cdb_instance_mode=readwrite;
set debug_sync = "mysql_create_table_begin wait_for flushed execute 1";
create table t3(a int, b int, c int);;
set global cdb_instance_mode=lockwrite;
ERROR 70100: Query execution was interrupted
create table t3(a int, b int, c int);
ERROR HY000: cdb instance is locked for writing.
create database db1;
ERROR HY000: cdb instance is locked for writing.
set global cdb_instance_mode=readwrite;
set debug_sync = "alter_table_before_open_tables wait_for flushed execute 1";
create index index1 on t1(a);;
set global cdb_instance_mode=lockwrite;
ERROR 70100: Query execution was interrupted
create index index1 on t1(a);
ERROR HY000: cdb instance is locked for writing.
set global cdb_instance_mode=readwrite;
create index index1 on t1(a);
set debug_sync = "alter_table_before_open_tables wait_for flushed execute 1";
alter table t1 drop index index1;;
set global cdb_instance_mode=lockwrite;
ERROR 70100: Query execution was interrupted
alter table t1 drop index index1;
ERROR HY000: cdb instance is locked for writing.
create view v1 as (select * from t1);
ERROR HY000: cdb instance is locked for writing.
set global cdb_instance_mode=lockread;
set global read_only=on;
select * from t1;
ERROR HY000: cdb instance is locked for reading.
set global cdb_instance_mode=readwrite;
set global cdb_working_mode_enabled=on;
set global cdb_working_mode_default=readwrite;
set global read_only=off;
drop table tt;
drop table tt1;
drop procedure test.per2;
drop table t1;
drop user 'user1'@'%';
