#
# Bug#109145/Bug#109190: Using index for skip scan cause incorrect result
#
drop table if exists afan_test_t;
Warnings:
Note	1051	Unknown table 'test.afan_test_t'
drop table if exists afan_test;
Warnings:
Note	1051	Unknown table 'test.afan_test'
create table afan_test_t(
id int auto_increment primary key,
the_date varchar(8) not null,
prj_id varchar(120) not null,
index index_1(the_date,prj_id));
insert into afan_test_t (the_date,prj_id) values('20220101','PRJID01'),('20220101','PRJID02'),('20220101','PRJID03'),('20220101','PRJID04'),('20220101','PRJID05'),('20220101','PRJID05'),('20220101','PRJID06'),('20220101','PRJID07'),('20220101','PRJID08'),('20220101','PRJID09'),('20220101','PRJID10');
insert into afan_test_t (the_date,prj_id) select the_date,prj_id from afan_test_t where prj_id = 'PRJID09';
insert into afan_test_t (the_date,prj_id) select the_date,prj_id from afan_test_t where prj_id = 'PRJID09';
insert into afan_test_t (the_date,prj_id) select the_date,prj_id from afan_test_t where prj_id = 'PRJID09';
insert into afan_test_t (the_date,prj_id) select the_date,prj_id from afan_test_t where prj_id = 'PRJID10';
insert into afan_test_t (the_date,prj_id) select the_date,prj_id from afan_test_t where prj_id = 'PRJID10';
insert into afan_test_t (the_date,prj_id) select the_date,prj_id from afan_test_t where prj_id = 'PRJID10';
insert into afan_test_t (the_date,prj_id) select the_date,prj_id from afan_test_t where prj_id = 'PRJID10';
insert into afan_test_t (the_date,prj_id) select the_date,prj_id from afan_test_t where prj_id = 'PRJID10';
insert into afan_test_t (the_date,prj_id) select the_date,prj_id from afan_test_t where prj_id = 'PRJID10';
insert into afan_test_t (the_date,prj_id) select the_date,prj_id from afan_test_t where prj_id = 'PRJID10';
create table afan_test like afan_test_t;
insert into afan_test (the_date,prj_id) select '20220109',prj_id from afan_test_t;
insert into afan_test (the_date,prj_id) select '20220110',prj_id from afan_test_t;
insert into afan_test (the_date,prj_id) select '20220111',prj_id from afan_test_t;
insert into afan_test (the_date,prj_id) select '20220112',prj_id from afan_test_t;
insert into afan_test (the_date,prj_id) select '20220113',prj_id from afan_test_t;
insert into afan_test (the_date,prj_id) select '20220114',prj_id from afan_test_t;
insert into afan_test (the_date,prj_id) select '20220201',prj_id from afan_test_t;
drop table if exists afan_test_t;
analyze table afan_test;
Table	Op	Msg_type	Msg_text
test.afan_test	analyze	status	OK
EXPLAIN SELECT /*+ SKIP_SCAN(afan_test index_1) */ max(the_date) from afan_test where prj_id = 'PRJID07';
id	select_type	table	partitions	type	possible_keys	key	key_len	ref	rows	filtered	Extra
1	SIMPLE	afan_test	NULL	range	index_1	index_1	516	NULL	101	100.00	Using where; Using index for skip scan
Warnings:
Note	1003	/* select#1 */ select /*+ SKIP_SCAN(`afan_test`@`select#1` `index_1`) */ max(`test`.`afan_test`.`the_date`) AS `max(the_date)` from `test`.`afan_test` where (`test`.`afan_test`.`prj_id` = 'PRJID07')
SELECT /*+ SKIP_SCAN(afan_test index_1) */ max(the_date) from afan_test where prj_id = 'PRJID07';
max(the_date)
20220201
delete from afan_test where the_date like '2022011%';
SELECT /*+ SKIP_SCAN(afan_test index_1) */ max(the_date) from afan_test where prj_id = 'PRJID07';
max(the_date)
20220201
DROP TABLE afan_test;
