SELECT id FROM mysql.tables LIMIT 1;
ERROR HY000: Access to data dictionary table 'mysql.tables' is rejected.
set allow_access_dd_tables=on;
SELECT id FROM mysql.tables LIMIT 1;
id
1
delete from mysql.tables where id=1;
ERROR HY000: Access to data dictionary table 'mysql.tables' is rejected.
SELECT * FROM mysql.schemata LIMIT 1;
SELECT * FROM mysql.catalogs LIMIT 1;
SELECT * FROM mysql.collations LIMIT 1;
SELECT * FROM mysql.tablespaces LIMIT 1;
SELECT * FROM mysql.table_stats LIMIT 1;
SELECT
(cat.name COLLATE utf8_tolower_ci) AS TABLE_CATALOG,
(sch.name COLLATE utf8_tolower_ci) AS TABLE_SCHEMA,
(tbl.name COLLATE utf8_tolower_ci) AS TABLE_NAME,
tbl.type AS TABLE_TYPE,
IF((tbl.type = 'BASE TABLE'),
tbl.engine,
NULL) AS ENGINE,
IF((tbl.type = 'VIEW'), NULL, 10) AS VERSION,
tbl.row_format AS ROW_FORMAT,
IF((tbl.type = 'VIEW'),
NULL,
INTERNAL_TABLE_ROWS(sch.name,
tbl.name,
IF((tbl.partition_type IS NULL),
tbl.engine,
''),
tbl.se_private_id,
(tbl.hidden <> 'Visible'),
ts.se_private_data,
COALESCE(stat.table_rows, 0),
COALESCE(CAST(stat.cached_time AS UNSIGNED),
0))) AS TABLE_ROWS,
IF((tbl.type = 'VIEW'),
NULL,
INTERNAL_AVG_ROW_LENGTH(sch.name,
tbl.name,
IF((tbl.partition_type IS NULL),
tbl.engine,
''),
tbl.se_private_id,
(tbl.hidden <> 'Visible'),
ts.se_private_data,
COALESCE(stat.avg_row_length, 0),
COALESCE(CAST(stat.cached_time AS UNSIGNED),
0))) AS AVG_ROW_LENGTH,
IF((tbl.type = 'VIEW'),
NULL,
INTERNAL_DATA_LENGTH(sch.name,
tbl.name,
IF((tbl.partition_type IS NULL),
tbl.engine,
''),
tbl.se_private_id,
(tbl.hidden <> 'Visible'),
ts.se_private_data,
COALESCE(stat.data_length, 0),
COALESCE(CAST(stat.cached_time AS UNSIGNED),
0))) AS DATA_LENGTH,
IF((tbl.type = 'VIEW'),
NULL,
INTERNAL_MAX_DATA_LENGTH(sch.name,
tbl.name,
IF((tbl.partition_type IS NULL),
tbl.engine,
''),
tbl.se_private_id,
(tbl.hidden <> 'Visible'),
ts.se_private_data,
COALESCE(stat.max_data_length, 0),
COALESCE(CAST(stat.cached_time AS UNSIGNED),
0))) AS MAX_DATA_LENGTH,
IF((tbl.type = 'VIEW'),
NULL,
INTERNAL_INDEX_LENGTH(sch.name,
tbl.name,
IF((tbl.partition_type IS NULL),
tbl.engine,
''),
tbl.se_private_id,
(tbl.hidden <> 'Visible'),
ts.se_private_data,
COALESCE(stat.index_length, 0),
COALESCE(CAST(stat.cached_time AS UNSIGNED),
0))) AS INDEX_LENGTH,
IF((tbl.type = 'VIEW'),
NULL,
INTERNAL_DATA_FREE(sch.name,
tbl.name,
IF((tbl.partition_type IS NULL),
tbl.engine,
''),
tbl.se_private_id,
(tbl.hidden <> 'Visible'),
ts.se_private_data,
COALESCE(stat.data_free, 0),
COALESCE(CAST(stat.cached_time AS UNSIGNED),
0))) AS DATA_FREE,
IF((tbl.type = 'VIEW'),
NULL,
INTERNAL_AUTO_INCREMENT(sch.name,
tbl.name,
IF((tbl.partition_type IS NULL),
tbl.engine,
''),
tbl.se_private_id,
(tbl.hidden <> 'Visible'),
ts.se_private_data,
COALESCE(stat.auto_increment, 0),
COALESCE(CAST(stat.cached_time AS UNSIGNED),
0),
tbl.se_private_data)) AS AUTO_INCREMENT,
tbl.created AS CREATE_TIME,
IF((tbl.type = 'VIEW'),
NULL,
INTERNAL_UPDATE_TIME(sch.name,
tbl.name,
IF((tbl.partition_type IS NULL),
tbl.engine,
''),
tbl.se_private_id,
(tbl.hidden <> 'Visible'),
ts.se_private_data,
COALESCE(CAST(stat.update_time AS UNSIGNED),
0),
COALESCE(CAST(stat.cached_time AS UNSIGNED),
0))) AS UPDATE_TIME,
IF((tbl.type = 'VIEW'),
NULL,
INTERNAL_CHECK_TIME(sch.name,
tbl.name,
IF((tbl.partition_type IS NULL),
tbl.engine,
''),
tbl.se_private_id,
(tbl.hidden <> 'Visible'),
ts.se_private_data,
COALESCE(CAST(stat.check_time AS UNSIGNED), 0),
COALESCE(CAST(stat.cached_time AS UNSIGNED),
0))) AS CHECK_TIME,
col.name AS TABLE_COLLATION,
IF((tbl.type = 'VIEW'),
NULL,
INTERNAL_CHECKSUM(sch.name,
tbl.name,
IF((tbl.partition_type IS NULL),
tbl.engine,
''),
tbl.se_private_id,
(tbl.hidden <> 'Visible'),
ts.se_private_data,
COALESCE(stat.checksum, 0),
COALESCE(CAST(stat.cached_time AS UNSIGNED),
0))) AS CHECKSUM,
IF((tbl.type = 'VIEW'),
NULL,
GET_DD_CREATE_OPTIONS(tbl.options,
IF((IFNULL(tbl.partition_expression,
'NOT_PART_TBL') = 'NOT_PART_TBL'),
0,
1),
IF((sch.default_encryption = 'YES'),
1,
0))) AS CREATE_OPTIONS,
INTERNAL_GET_COMMENT_OR_ERROR(sch.name,
tbl.name,
tbl.type,
tbl.options,
tbl.comment) AS TABLE_COMMENT
FROM
(((((mysql.tables tbl
JOIN mysql.schemata sch ON ((tbl.schema_id = sch.id)))
JOIN mysql.catalogs cat ON ((cat.id = sch.catalog_id)))
LEFT JOIN mysql.collations col ON ((tbl.collation_id = col.id)))
LEFT JOIN mysql.tablespaces ts ON ((tbl.tablespace_id = ts.id)))
LEFT JOIN mysql.table_stats stat ON (((tbl.name = stat.table_name)
AND (sch.name = stat.schema_name))))
WHERE
((0 <> CAN_ACCESS_TABLE(sch.name, tbl.name))
AND (0 <> IS_VISIBLE_DD_OBJECT(tbl.hidden)));
