# restart: --early-plugin-load=keyring_file=keyring_file.so --loose-keyring_file_data=MYSQL_TMP_DIR/mysecret_keyring_log1 --general-log --log-output=FILE --general_log_file=MYSQL_TMP_DIR/keyring_query_log --plugin-dir=KEYRING_PLUGIN_PATH 
SHOW VARIABLES LIKE  "innodb_encryption_algorithm";
Variable_name	Value
innodb_encryption_algorithm	AES
SET GLOBAL innodb_encryption_algorithm = 'sm4';
SHOW VARIABLES LIKE  "innodb_encryption_algorithm";
Variable_name	Value
innodb_encryption_algorithm	SM4
CREATE TABLE t (id INT PRIMARY KEY, name VARCHAR(20)) ENCRYPTION='y';
SELECT name,encryption,encryption_algorithm FROM information_schema.innodb_tablespaces WHERE name LIKE '%/t';
name	encryption	encryption_algorithm
test/t	Y	SM4
INSERT INTO t VALUES(1, 'kongzhi');
SELECT * FROM t;
id	name
1	kongzhi
# restart: --early-plugin-load=keyring_file=keyring_file.so --loose-keyring_file_data=MYSQL_TMP_DIR/mysecret_keyring_log1 --general-log --log-output=FILE --general_log_file=MYSQL_TMP_DIR/keyring_query_log --plugin-dir=KEYRING_PLUGIN_PATH 
SELECT * FROM t;
id	name
1	kongzhi
ALTER INSTANCE ROTATE INNODB MASTER KEY;
INSERT INTO t VALUES(2, 'kongzhi2');
# restart: --early-plugin-load=keyring_file=keyring_file.so --loose-keyring_file_data=MYSQL_TMP_DIR/mysecret_keyring_log1 --general-log --log-output=FILE --general_log_file=MYSQL_TMP_DIR/keyring_query_log --plugin-dir=KEYRING_PLUGIN_PATH 
SELECT * FROM t;
id	name
1	kongzhi
2	kongzhi2
set global innodb_encryption_algorithm='sm4';
CREATE TABLE t1(id INT PRIMARY KEY, name VARCHAR(20)) ENCRYPTION='y';
ALTER TABLE t1 DISCARD TABLESPACE;
FLUSH TABLES t FOR EXPORT;
UNLOCK TABLES;
ALTER TABLE t1 IMPORT TABLESPACE;
SELECT * FROM t1;
id	name
1	kongzhi
2	kongzhi2
SET GLOBAL innodb_encryption_algorithm='aes';
CREATE TABLE t2(id INT PRIMARY KEY, name VARCHAR(20)) ENCRYPTION='y';
ALTER TABLE t2 DISCARD TABLESPACE;
FLUSH TABLES t FOR EXPORT;
UNLOCK TABLES;
ALTER TABLE t2 IMPORT TABLESPACE;
ERROR HY000: Schema mismatch (Table is in an encrypted tablespace, but the encryption algorithm is not the same while importing.)
DROP TABLE t1;
DROP TABLE t2;
DROP TABLE t;
CREATE TABLE t(id INT PRIMARY KEY, name VARCHAR(20)) ENCRYPTION='y';
SELECT name,encryption,encryption_algorithm FROM information_schema.innodb_tablespaces WHERE name LIKE '%/t';
name	encryption	encryption_algorithm
test/t	Y	AES
INSERT INTO t VALUES(1, 'kongzhi');
ALTER TABLE t ENCRYPTION='n';
SET GLOBAL innodb_encryption_algorithm='sm4';
ALTER TABLE t ENCRYPTION='y';
SELECT name,encryption,encryption_algorithm FROM information_schema.innodb_tablespaces WHERE name LIKE '%/t';
name	encryption	encryption_algorithm
test/t	Y	SM4
# restart: --early-plugin-load=keyring_file=keyring_file.so --loose-keyring_file_data=MYSQL_TMP_DIR/mysecret_keyring_log1 --general-log --log-output=FILE --general_log_file=MYSQL_TMP_DIR/keyring_query_log --plugin-dir=KEYRING_PLUGIN_PATH 
SELECT * FROM t;
id	name
1	kongzhi
SET GLOBAL innodb_redo_log_encrypt=ON;
DELETE FROM t;
BEGIN;
INSERT INTO t VALUES(0, "aaaaa");
INSERT INTO t VALUES(1, "bbbbb");
INSERT INTO t VALUES(2, "ccccc");
INSERT INTO t VALUES(3, "ddddd");
INSERT INTO t VALUES(4, "eeeee");
INSERT INTO t VALUES(5, "fffff");
INSERT INTO t VALUES(6, "ggggg");
INSERT INTO t VALUES(7, "hhhhh");
INSERT INTO t VALUES(8, "iiiii");
INSERT INTO t VALUES(9, "jjjjj");
# Kill the server
SELECT name,encryption,encryption_algorithm FROM information_schema.innodb_tablespaces WHERE name LIKE '%/t';
name	encryption	encryption_algorithm
test/t	Y	SM4
SELECT * FROM t ORDER BY name LIMIT 10;
id	name
DELETE FROM t;
SET GLOBAL innodb_redo_log_encrypt=ON;
START TRANSACTION;
INSERT INTO t VALUES(0, "aaaaa");
INSERT INTO t VALUES(1, "bbbbb");
SET GLOBAL innodb_undo_log_encrypt = OFF;
INSERT INTO t VALUES(2, "ccccc");
INSERT INTO t VALUES(3, "ddddd");
SET GLOBAL innodb_undo_log_encrypt = ON;
INSERT INTO t VALUES(4, "eeeee");
INSERT INTO t VALUES(5, "fffff");
COMMIT;
START TRANSACTION;
INSERT INTO t VALUES(6, "ggggg");
SET GLOBAL innodb_undo_log_encrypt = OFF;
INSERT INTO t VALUES(7, "hhhhh");
INSERT INTO t VALUES(8, "iiiii");
SET GLOBAL innodb_undo_log_encrypt = ON;
INSERT INTO t VALUES(9, "jjjjj");
SHOW VARIABLES LIKE "%innodb_redo_log_encrypt%";
Variable_name	Value
innodb_redo_log_encrypt	ON
SHOW VARIABLES LIKE "%innodb_undo_log_encrypt%";
Variable_name	Value
innodb_undo_log_encrypt	ON
# Kill and restart to confirm the encryption info can be retrieved properly.
# Kill the server
SELECT * FROM t ORDER BY name LIMIT 10;
id	name
0	aaaaa
1	bbbbb
2	ccccc
3	ddddd
4	eeeee
5	fffff
SET GLOBAL innodb_encryption_algorithm='aes';
SET GLOBAL innodb_redo_log_encrypt=OFF;
SET GLOBAL innodb_undo_log_encrypt=OFF;
DROP TABLE t;
