DROP DATABASE IF EXISTS dbtest_gts;
CREATE DATABASE dbtest_gts;
use dbtest_gts;
drop table if exists t;
create table t(id int primary key, name char(10),gts int, index i_name(name));
insert into t values(1,'a',0);
insert into t values(2,'b',0);
insert into t values(3,'c',0);
insert into t values(4,'d',0);
insert into t values(5,'e',0);
insert into t values(6,'f',0);
XA start 'a' tdsql_withgts 100;
insert into t values(7,'g',101);
XA end 'a';
XA prepare 'a';
XA commit 'a' tdsql_withgts 101;
XA start 'a' tdsql_withgts 101;
delete from t where id=1;
XA end 'a';
XA prepare 'a';
use dbtest_gts;
select *from t force index(primary) tdsql_withgts 100;
id	name	gts
1	a	0
2	b	0
3	c	0
4	d	0
5	e	0
6	f	0
select *from t force index(primary) tdsql_withgts 101;
use dbtest_gts;
select *from t force index(primary) tdsql_withgts 102;
xa commit 'a' tdsql_withgts 102;
id	name	gts
1	a	0
2	b	0
3	c	0
4	d	0
5	e	0
6	f	0
7	g	101
id	name	gts
2	b	0
3	c	0
4	d	0
5	e	0
6	f	0
7	g	101
XA start 'a' tdsql_withgts 102;
insert into t values(8,'g',103);
XA end 'a';
XA prepare 'a';
XA commit 'a' tdsql_withgts 103;
XA start 'a' tdsql_withgts 103;
delete from t where id=2;
XA end 'a';
XA prepare 'a';
use dbtest_gts;
XA start 'b' tdsql_withgts 102;
select *from t force index(primary) ;
id	name	gts
2	b	0
3	c	0
4	d	0
5	e	0
6	f	0
7	g	101
XA end 'b';
XA prepare 'b';
XA commit 'b' tdsql_withgts 104;
XA start 'b' tdsql_withgts 104;
select *from t force index(primary);
XA start 'c' tdsql_withgts 105;
select *from t force index(primary);
xa commit 'a' tdsql_withgts 105;
id	name	gts
2	b	0
3	c	0
4	d	0
5	e	0
6	f	0
7	g	101
8	g	103
XA end 'b';
XA prepare 'b';
XA commit 'b' tdsql_withgts 106;
id	name	gts
3	c	0
4	d	0
5	e	0
6	f	0
7	g	101
8	g	103
XA end 'c';
XA prepare 'c';
XA commit 'c' tdsql_withgts 107;
XA start 'a';
delete from t where id=3;
XA end 'a';
XA prepare 'a';
use dbtest_gts;
XA start 'b' tdsql_withgts 107;
select *from t force index(primary);
id	name	gts
3	c	0
4	d	0
5	e	0
6	f	0
7	g	101
8	g	103
XA end 'b';
XA prepare 'b';
XA commit 'b' tdsql_withgts 108;
select *from t force index(primary) tdsql_withgts 108;
id	name	gts
3	c	0
4	d	0
5	e	0
6	f	0
7	g	101
8	g	103
xa commit 'a';
DROP DATABASE dbtest_gts;
PURGE TDSQL_TLOG logs;
