DROP DATABASE IF EXISTS dbtest_gts;
CREATE DATABASE dbtest_gts;
use dbtest_gts;
drop table if exists t;
create table t(id int primary key, name char(10),gts int, index i_name(name));
insert into t values(1,'a',0);
insert into t values(2,'b',0);
XA start 'a' tdsql_withgts 800;
insert into t values(3,'c',801);
XA end 'a';
XA prepare 'a';
XA commit 'a' tdsql_withgts 801;
XA start 'a' tdsql_withgts 801;
select name from t force index(i_name);
name
a
b
c
update t set gts=802 where id =1;
delete from t where id = 2;
insert into t values(4,'d',802);
XA end 'a';
XA prepare 'a';
use dbtest_gts;
select name from t force index(i_name) tdsql_withgts 800;
name
a
b
select name from t force index(i_name) tdsql_withgts 801;
use dbtest_gts;
select name from t force index(i_name) tdsql_withgts 802;
xa commit 'a' tdsql_withgts 802;
name
a
b
c
name
a
c
d
XA start 'a' tdsql_withgts 802;
insert into t values(5,'e',803);
XA end 'a';
XA prepare 'a';
XA commit 'a' tdsql_withgts 803;
XA start 'a' tdsql_withgts 803;
select  name from t force index(i_name);
name
a
c
d
e
update t set gts=805 where id =3;
delete from t where id = 4;
insert into t values(6,'f',804);
XA end 'a';
XA prepare 'a';
use dbtest_gts;
XA start 'b' tdsql_withgts 802;
select name from t force index(i_name);
name
a
c
d
XA end 'b';
XA prepare 'b';
XA commit 'b' tdsql_withgts 803;
XA start 'b' tdsql_withgts 803;
select name from t force index(i_name);
use dbtest_gts;
XA start 'c' tdsql_withgts 804;
select name from t force index(i_name);
xa commit 'a' tdsql_withgts 804;
name
a
c
d
e
XA end 'b';
XA prepare 'b';
XA commit 'b' tdsql_withgts 805;
name
a
c
e
f
XA end 'c';
XA prepare 'c';
XA commit 'c' tdsql_withgts 806;
XA start 'a';
select name from t force index(i_name);
name
a
c
e
f
update t set gts=805 where id =5;
delete from t where id = 3;
insert into t values(7,'g',0);
XA end 'a';
XA prepare 'a';
use dbtest_gts;
XA start 'b' tdsql_withgts 806;
select name from t force index(i_name);
name
a
c
e
f
XA end 'b';
XA prepare 'b';
XA commit 'b' tdsql_withgts 807;
select name from t force index(i_name) tdsql_withgts 808;
name
a
c
e
f
xa commit 'a' tdsql_withgts 809;
select name from t force index(i_name) tdsql_withgts 809;
name
a
e
f
g
DROP DATABASE dbtest_gts;
PURGE TDSQL_TLOG logs;
