DROP DATABASE IF EXISTS dbtest_gts;
CREATE DATABASE dbtest_gts;
use dbtest_gts;
drop table if exists t;
create table t(id int primary key, name char(10),gts int, index i_name(name));
insert into t values(1,'a',0);
insert into t values(2,'b',0);
XA start 'a' tdsql_withgts 700;
insert into t values(3,'c',701);
XA end 'a';
XA prepare 'a';
XA commit 'a' tdsql_withgts 701;
XA start 'a' tdsql_withgts 701;
select *from t;
id	name	gts
1	a	0
2	b	0
3	c	701
update t set gts=702 where id =1;
delete from t where id = 2;
insert into t values(4,'d',702);
XA end 'a';
XA prepare 'a';
use dbtest_gts;
select *from t force index(primary) tdsql_withgts 700;
id	name	gts
1	a	0
2	b	0
select *from t force index(primary) tdsql_withgts 701;
use dbtest_gts;
select *from t force index(primary) tdsql_withgts 702;
xa commit 'a' tdsql_withgts 702;
id	name	gts
1	a	0
2	b	0
3	c	701
id	name	gts
1	a	702
3	c	701
4	d	702
XA start 'a' tdsql_withgts 702;
insert into t values(5,'e',703);
XA end 'a';
XA prepare 'a';
XA commit 'a' tdsql_withgts 703;
XA start 'a' tdsql_withgts 703;
select *from t;
id	name	gts
1	a	702
3	c	701
4	d	702
5	e	703
update t set gts=705 where id =3;
delete from t where id = 4;
insert into t values(6,'f',704);
XA end 'a';
XA prepare 'a';
use dbtest_gts;
XA start 'b' tdsql_withgts 702;
select *from t force index(primary);
id	name	gts
1	a	702
3	c	701
4	d	702
XA end 'b';
XA prepare 'b';
XA commit 'b' tdsql_withgts 703;
XA start 'b' tdsql_withgts 703;
select *from t force index(primary);
use dbtest_gts;
XA start 'c' tdsql_withgts 704;
select *from t force index(primary);
xa commit 'a' tdsql_withgts 704;
id	name	gts
1	a	702
3	c	701
4	d	702
5	e	703
XA end 'b';
XA prepare 'b';
XA commit 'b' tdsql_withgts 705;
id	name	gts
1	a	702
3	c	705
5	e	703
6	f	704
XA end 'c';
XA prepare 'c';
XA commit 'c' tdsql_withgts 706;
XA start 'a';
select *from t;
id	name	gts
1	a	702
3	c	705
5	e	703
6	f	704
update t set gts=705 where id =5;
delete from t where id = 3;
insert into t values(7,'g',0);
XA end 'a';
XA prepare 'a';
use dbtest_gts;
XA start 'b' tdsql_withgts 706;
select *from t force index(primary);
id	name	gts
1	a	702
3	c	705
5	e	703
6	f	704
XA end 'b';
XA prepare 'b';
XA commit 'b' tdsql_withgts 707;
select *from t force index(primary) tdsql_withgts 708;
id	name	gts
1	a	702
3	c	705
5	e	703
6	f	704
xa commit 'a' tdsql_withgts 709;
select *from t force index(primary) tdsql_withgts 709;
id	name	gts
1	a	702
5	e	705
6	f	704
7	g	0
DROP DATABASE dbtest_gts;
PURGE TDSQL_TLOG logs;
